{
  "schema_version": "0.1",
  "plan_id": "seeded-3-day-peanut-allergy-baseline",
  "description": "Baseline three-day meal-prep plan with resolved foods and prep-safety notes.",
  "days": [
    {
      "day": 1,
      "meals": [
        {
          "name": "breakfast",
          "items": [
            {
              "food": "cooked oatmeal",
              "quantity": 1,
              "unit": "cup",
              "preparation": "plain"
            },
            {
              "food": "blueberries",
              "quantity": 0.5,
              "unit": "cup"
            },
            {
              "food": "plain Greek yogurt",
              "quantity": 1,
              "unit": "cup"
            }
          ]
        },
        {
          "name": "lunch",
          "items": [
            {
              "food": "chicken breast",
              "quantity": 6,
              "unit": "oz",
              "preparation": "grilled"
            },
            {
              "food": "brown rice",
              "quantity": 1,
              "unit": "cup"
            },
            {
              "food": "broccoli",
              "quantity": 1,
              "unit": "cup"
            }
          ]
        },
        {
          "name": "dinner",
          "items": [
            {
              "food": "salmon",
              "quantity": 6,
              "unit": "oz",
              "preparation": "baked"
            },
            {
              "food": "sweet potato",
              "quantity": 1,
              "unit": "serving"
            },
            {
              "food": "spinach",
              "quantity": 2,
              "unit": "cup"
            },
            {
              "food": "olive oil",
              "quantity": 1,
              "unit": "tbsp"
            }
          ]
        }
      ]
    },
    {
      "day": 2,
      "meals": [
        {
          "name": "breakfast",
          "items": [
            {
              "food": "egg",
              "quantity": 1,
              "unit": "serving",
              "preparation": "scrambled"
            },
            {
              "food": "whole wheat bread",
              "quantity": 1,
              "unit": "serving"
            },
            {
              "food": "apple",
              "quantity": 1,
              "unit": "serving"
            }
          ]
        },
        {
          "name": "lunch",
          "items": [
            {
              "food": "black beans",
              "quantity": 1,
              "unit": "cup"
            },
            {
              "food": "brown rice",
              "quantity": 1,
              "unit": "cup"
            },
            {
              "food": "spinach",
              "quantity": 2,
              "unit": "cup"
            }
          ]
        },
        {
          "name": "dinner",
          "items": [
            {
              "food": "chicken breast",
              "quantity": 6,
              "unit": "oz"
            },
            {
              "food": "broccoli",
              "quantity": 1,
              "unit": "cup"
            },
            {
              "food": "sweet potato",
              "quantity": 1,
              "unit": "serving"
            }
          ]
        }
      ]
    },
    {
      "day": 3,
      "meals": [
        {
          "name": "breakfast",
          "items": [
            {
              "food": "plain Greek yogurt",
              "quantity": 1,
              "unit": "cup"
            },
            {
              "food": "blueberries",
              "quantity": 0.5,
              "unit": "cup"
            },
            {
              "food": "cooked oatmeal",
              "quantity": 1,
              "unit": "cup"
            }
          ]
        },
        {
          "name": "lunch",
          "items": [
            {
              "food": "chicken breast",
              "quantity": 6,
              "unit": "oz"
            },
            {
              "food": "brown rice",
              "quantity": 1,
              "unit": "cup"
            },
            {
              "food": "spinach",
              "quantity": 2,
              "unit": "cup"
            }
          ]
        },
        {
          "name": "dinner",
          "items": [
            {
              "food": "salmon",
              "quantity": 6,
              "unit": "oz"
            },
            {
              "food": "broccoli",
              "quantity": 1,
              "unit": "cup"
            },
            {
              "food": "olive oil",
              "quantity": 1,
              "unit": "tbsp"
            }
          ]
        }
      ]
    }
  ],
  "shopping_list": [
    {
      "food": "cooked oatmeal",
      "quantity": 3,
      "unit": "cup"
    },
    {
      "food": "plain Greek yogurt",
      "quantity": 2,
      "unit": "cup"
    },
    {
      "food": "chicken breast",
      "quantity": 24,
      "unit": "oz"
    },
    {
      "food": "brown rice",
      "quantity": 3,
      "unit": "cup"
    },
    {
      "food": "broccoli",
      "quantity": 3,
      "unit": "cup"
    }
  ],
  "prep_notes": [
    "Cook proteins to safe internal temperatures.",
    "Refrigerate leftovers promptly within 2 hours.",
    "Store raw meat separately from ready-to-eat foods."
  ]
}
